Position,Const,Created,Modified,Description,Title,Original Title,URL,Title Type,IMDb Rating,Runtime (mins),Year,Genres,Num Votes,Release Date,Directors
357,tt0078560,2019-08-31,2019-08-31,,"Akage no An","Akage no An",https://www.imdb.com/title/tt0078560/,Série de TV,7.7,24,1979,"Animação, Drama, Família, Romance",2208,1979-01-07,
358,tt0498443,2019-08-31,2019-08-31,,"Paradise Kiss","Paradise Kiss",https://www.imdb.com/title/tt0498443/,Série de TV,7.7,23,2005,"Animação, Comédia, Drama, Romance",2235,2005-10-13,
359,tt0813971,2019-08-31,2019-08-31,,"Witchblade","Witchblade",https://www.imdb.com/title/tt0813971/,Série de TV,6.9,30,2006,"Animação, Ação, Aventura, Drama, Terror, Ficção científica",1670,2006-04-05,
360,tt1161669,2019-08-31,2019-08-31,,"Kaze no stigma","Kaze no stigma",https://www.imdb.com/title/tt1161669/,Série de TV,7.1,24,2007,"Animação, Ação, Comédia, Fantasia, Romance",1950,2007-04-12,
361,tt2789238,2019-08-31,2019-08-31,,"Strike the Blood","Strike the Blood",https://www.imdb.com/title/tt2789238/,Série de TV,6.9,24,2013,"Animação, Ação, Comédia, Fantasia, Romance",1924,2013-10-04,
362,tt0218775,2019-08-31,2019-08-31,,"Monster Farm: Enbanseki no himitsu","Monster Farm: Enbanseki no himitsu",https://www.imdb.com/title/tt0218775/,Série de TV,6.9,,1999,"Animação, Ação, Aventura, Comédia, Drama, Família, Fantasia, Ficção científica",1590,2000-07-08,
363,tt1196094,2019-08-31,2019-08-31,,"Yu-Gi-Oh! 5D's","Yûgiô: 5D's",https://www.imdb.com/title/tt1196094/,Série de TV,7.0,,2008,"Animação, Ação, Aventura, Fantasia, Ficção científica",2119,2008-04-02,
364,tt0088109,2019-08-31,2019-08-31,,"Detetive Holmes","Meitantei Holmes",https://www.imdb.com/title/tt0088109/,Série de TV,7.5,24,1984,"Animação, Ação, Aventura, Comédia, Policial, Família, Mistério",1704,1984-11-06,
365,tt0243694,2019-08-31,2019-08-31,,"Digimon","Dejimon adobenchâ 02",https://www.imdb.com/title/tt0243694/,Série de TV,7.4,30,2000,"Animação, Ação, Aventura, Comédia, Policial, Drama, Família, Fantasia, Ficção científica, Suspense",2119,,
366,tt1214373,2019-08-31,2019-08-31,,"Itazura na Kiss","Itazura na Kiss",https://www.imdb.com/title/tt1214373/,Série de TV,7.3,24,2008,"Animação, Comédia, Drama, Romance",1869,2008-04-04,
367,tt1224144,2019-08-31,2019-08-31,,"Katei Kyoshi Hitman Reborn!","Katei Kyoshi Hitman Reborn!",https://www.imdb.com/title/tt1224144/,Série de TV,7.6,,2006,"Animação, Ação, Comédia, Fantasia",1840,2006-10-07,
368,tt0878230,2019-08-31,2019-08-31,,"Black Blood Brothers","Black Blood Brothers",https://www.imdb.com/title/tt0878230/,Série de TV,6.8,,2006,"Animação, Ação, Comédia, Fantasia, Terror",1299,2006-09-08,
369,tt0122336,2019-08-31,2019-08-31,,"Captain Future","Captain Future",https://www.imdb.com/title/tt0122336/,Série de TV,7.9,30,1978,"Animação, Aventura, Ficção científica",1640,1978-11-07,
370,tt0387724,2019-08-31,2019-08-31,,"Blue Gender","Blue Gender",https://www.imdb.com/title/tt0387724/,Série de TV,7.2,23,1999,"Animação, Ação, Aventura, Drama, Fantasia, Terror, Ficção científica",1373,1999-10-07,
371,tt0953916,2019-08-31,2019-08-31,,"Air Gear","Air Gear",https://www.imdb.com/title/tt0953916/,Série de TV,7.1,25,2006,"Animação, Ação, Comédia, Esportes",1486,2006-04-04,
372,tt0809815,2019-08-31,2019-08-31,,"Tenjho Tenge","Tenjô tenge",https://www.imdb.com/title/tt0809815/,Série de TV,6.8,23,2004,"Animação, Ação, Comédia, Drama, Romance",1405,2004-04-01,
373,tt3981938,2019-08-31,2019-08-31,,"Shingeki no Bahamut: Genesis","Shingeki no Bahamut: Genesis",https://www.imdb.com/title/tt3981938/,Série de TV,7.3,24,2014,"Animação, Ação, Aventura, Fantasia",1759,2014-09-01,
374,tt9522300,2019-08-31,2019-08-31,,"Kaguya-Sama: Love is War","Kaguya-sama wa kokurasetai ~ Tensai tachi no ren'ai zunô sen ~",https://www.imdb.com/title/tt9522300/,Série de TV,8.5,24,2019,"Animação, Comédia, Romance, Suspense",22979,2019-09-05,
375,tt0872301,2019-08-31,2019-08-31,,"Aa Megamisama","Aa Megamisama",https://www.imdb.com/title/tt0872301/,Série de TV,7.2,25,2005,"Animação, Comédia, Drama, Fantasia, Romance",1270,2005-01-06,
376,tt0307427,2019-08-31,2019-08-31,,"Scryed","Scryed",https://www.imdb.com/title/tt0307427/,Série de TV,6.9,629,2001,"Animação, Ação, Aventura, Fantasia, Ficção científica",1197,2001-07-04,
377,tt2070571,2019-08-31,2019-08-31,,"X-Men","X-Men",https://www.imdb.com/title/tt2070571/,Minissérie de televisão,6.8,23,2011,"Animação, Ação, Ficção científica",2644,2011-04-01,
378,tt0220218,2019-08-31,2019-08-31,,"Cyber City Oedo 808","Saibâ shiti Oedo 808",https://www.imdb.com/title/tt0220218/,Minissérie de televisão,7.5,40,1990,"Animação, Ação, Aventura, Policial, Terror, Ficção científica, Suspense",2507,1990-06-21,
379,tt3127798,2019-08-31,2019-08-31,,"Corpse Party: Tortured Souls","Corpse Party: Tortured Souls",https://www.imdb.com/title/tt3127798/,Minissérie de televisão,6.3,29,2013,"Animação, Terror, Mistério, Suspense",2587,2013-07-24,
380,tt0088863,2019-08-31,2019-08-31,,"Bubblegum Crisis","Baburugamu kuraishisu",https://www.imdb.com/title/tt0088863/,Minissérie de televisão,7.3,25,1987,"Animação, Ação, Fantasia, Ficção científica, Suspense",1877,1987-02-25,
381,tt1634165,2019-08-31,2019-08-31,,"B-gata H-kei","B-gata H-kei",https://www.imdb.com/title/tt1634165/,Minissérie de televisão,7.1,25,2010,"Animação, Comédia, Drama, Romance",1755,2010-04-01,
382,tt4623042,2019-08-31,2019-08-31,,"Yamada-kun and the Seven Witches","Yamada-kun to 7-nin no Majo",https://www.imdb.com/title/tt4623042/,Série de TV,7.2,24,2014,"Animação, Comédia, Fantasia, Romance",2841,2015-04-12,
383,tt0427531,2019-08-31,2019-08-31,,"Mezo forute","Mezo forute",https://www.imdb.com/title/tt0427531/,Minissérie de televisão,6.7,80,2000,"Animação, Ação, Comédia, Policial, Ficção científica, Suspense",1638,2000-05-25,
384,tt0278926,2019-08-31,2019-08-31,,"Ao no roku go","Ao no roku go",https://www.imdb.com/title/tt0278926/,Minissérie de televisão,6.7,,1998,"Animação, Ação, Ficção científica",1353,1998-10-25,
385,tt4431276,2019-09-01,2019-09-01,,"Magi: Adventure of Sinbad","Magi: Shindobaddo no bôken",https://www.imdb.com/title/tt4431276/,Minissérie de televisão,7.4,24,2016,"Animação, Aventura, Fantasia",2657,2016-04-16,
386,tt2294048,2019-09-02,2019-09-02,,"Zetsuen No Tempest","Zetsuen No Tempest",https://www.imdb.com/title/tt2294048/,Série de TV,7.4,25,2012,"Animação, Ação, Fantasia, Mistério",1699,2012-10-05,
387,tt2902582,2019-09-22,2019-09-22,,"Danganronpa: Kibô no gakuen to zetsubô no kôkôsei - The animation","Danganronpa: Kibô no gakuen to zetsubô no kôkôsei - The animation",https://www.imdb.com/title/tt2902582/,Série de TV,6.8,25,2013,"Animação, Ação, Policial, Família, Mistério, Suspense",3561,2013-07-04,
388,tt0435033,2019-10-19,2019-10-19,,"Hunter x Hunter: Greed Island","Hunter x Hunter: Greed Island",https://www.imdb.com/title/tt0435033/,Minissérie de televisão,8.4,22,2003,"Animação, Curta-Metragem, Ação, Aventura, Ficção científica",1822,2008-08-27,
389,tt5095466,2019-10-19,2019-10-19,,"Gakusen toshi asterisk","Gakusen toshi asterisk",https://www.imdb.com/title/tt5095466/,Série de TV,6.8,23,2015,"Animação, Ação, Comédia, Fantasia, Romance, Ficção científica",2704,2015-10-03,
390,tt5701624,2019-10-21,2019-10-21,,"Sakamoto desu ga?","Sakamoto desu ga?",https://www.imdb.com/title/tt5701624/,Minissérie de televisão,7.1,24,2016,"Animação, Comédia",2824,2016-04-08,
391,tt6455986,2019-10-26,2019-10-26,,"Yojo Senki: Saga of Tanya the Evil","Yojo Senki: Saga of Tanya the Evil",https://www.imdb.com/title/tt6455986/,Série de TV,7.6,24,2017,"Animação, Ação, Aventura, Fantasia, Guerra",4722,2017-01-06,
392,tt9058134,2019-12-16,2019-12-16,,"Kengan Ashura","Kengan Ashura",https://www.imdb.com/title/tt9058134/,Série de TV,7.9,,2019,"Animação, Ação, Esportes",8025,2019-07-31,
393,tt7978710,2019-12-20,2019-12-20,,"Sword Art Online Alternative: Gun Gale Online","Sword Art Online Alternative: Gun Gale Online",https://www.imdb.com/title/tt7978710/,Série de TV,6.8,24,2018,"Animação, Ação, Aventura, Comédia, Drama, Fantasia, Ficção científica",2969,2018-04-08,
394,tt7484994,2019-12-24,2019-12-24,,"Kujira no kora wa sajô ni utau","Kujira no kora wa sajô ni utau",https://www.imdb.com/title/tt7484994/,Minissérie de televisão,7.0,24,2017,"Animação, Drama, Fantasia, Mistério, Ficção científica",1912,2017-10-08,
395,tt0159208,2019-12-24,2019-12-24,,"City Hunter","City Hunter",https://www.imdb.com/title/tt0159208/,Série de TV,7.7,24,1987,"Animação, Ação, Comédia, Policial, Mistério, Romance",1710,1987-04-06,
396,tt0296319,2019-12-24,2019-12-24,,"Super Campeões","Captain Tsubasa J",https://www.imdb.com/title/tt0296319/,Série de TV,7.6,24,1994,"Animação, Drama, Família, Romance, Esportes",1859,1994-10-21,
397,tt0169473,2019-12-24,2019-12-24,,"Mazinger Z","Majingâ Zetto",https://www.imdb.com/title/tt0169473/,Série de TV,7.8,30,1972,"Ação, Animação, Ficção científica",1623,1972-12-03,
398,tt0366848,2019-12-24,2019-12-24,,"Onegai Teacher","Onegai Teacher",https://www.imdb.com/title/tt0366848/,Série de TV,6.9,25,2002,"Animação, Comédia, Romance, Ficção científica",1289,2002-01-10,
399,tt1945730,2019-12-24,2019-12-24,,"Katanagatari","Katanagatari",https://www.imdb.com/title/tt1945730/,Minissérie de televisão,7.8,50,2010,"Animação, Ação, Aventura, Comédia, Drama, Romance",1675,2010-01-25,
400,tt2269368,2019-12-24,2019-12-24,,"Hagure Yusha no Aestetica","Hagure Yusha no Aestetica",https://www.imdb.com/title/tt2269368/,Série de TV,6.8,23,2012,"Animação, Ação, Fantasia",2231,2012-07-06,
401,tt9307686,2020-01-02,2020-01-02,,"Fire Force","Enen no Shôbôtai",https://www.imdb.com/title/tt9307686/,Série de TV,7.6,23,2019,"Animação, Ação, Drama, Fantasia",12818,2019-07-05,
402,tt3532752,2020-01-03,2020-01-03,,"Trinity Seven: 7-nin no Masho Tsukai","Trinity Seven: 7-nin no Masho Tsukai",https://www.imdb.com/title/tt3532752/,Série de TV,6.7,24,2014,"Animação, Ação, Comédia, Fantasia, Romance",3029,2014-09-01,
