Position,Const,Created,Modified,Description,Title,Original Title,URL,Title Type,IMDb Rating,Runtime (mins),Year,Genres,Num Votes,Release Date,Directors
237,tt0312258,2017-10-09,2017-10-09,,"X","Ekkusu",https://www.imdb.com/title/tt0312258/,Série de TV,7.5,24,2001,"Animação, Ação, Drama, Fantasia, Suspense",1908,2001-10-03,
238,tt1799631,2017-06-30,2017-06-30,,"Ao no ekusoshisuto","Ao no ekusoshisuto",https://www.imdb.com/title/tt1799631/,Série de TV,7.4,30,2011,"Animação, Ação, Drama, Fantasia, Terror",15841,2011-04-17,
239,tt0107731,2018-05-27,2018-05-27,,"Oh! My Goddess","Aa! Megamisama!",https://www.imdb.com/title/tt0107731/,Minissérie de televisão,7.4,160,1993,"Animação, Comédia, Drama, Fantasia, Romance",1293,1993-02-21,
240,tt1882240,2017-08-03,2017-08-03,,"Beelzebub","Beelzebub",https://www.imdb.com/title/tt1882240/,Série de TV,7.5,,2011,"Animação, Ação, Comédia, Drama, Fantasia",2443,2011-01-09,
241,tt0985285,2018-02-27,2018-02-27,,"Ghost Hunt","Ghost Hunt",https://www.imdb.com/title/tt0985285/,Série de TV,7.4,25,2006,"Animação, Comédia, Drama, Terror, Mistério, Suspense",1691,2006-10-03,
242,tt0240493,2017-07-21,2017-07-21,,"Animê Experimental Excel Saga","Heppoko jikken animêshon excel saga",https://www.imdb.com/title/tt0240493/,Série de TV,7.5,,1999,"Animação, Comédia, Drama, Ficção científica",1489,1999-10-08,
243,tt0112166,2017-08-18,2017-08-18,,"Slayers","Sureiyâzu",https://www.imdb.com/title/tt0112166/,Série de TV,7.5,25,1995,"Animação, Ação, Aventura, Comédia, Drama, Família, Fantasia",2461,1995-04-07,
244,tt1410218,2017-06-30,2017-06-30,,"K-On!","K-On!",https://www.imdb.com/title/tt1410218/,Série de TV,7.8,24,2009,"Animação, Comédia, Drama, Família, Musical",4863,2009-04-02,
245,tt4958580,2017-06-30,2017-06-30,,"Gate: Jieitai Kanochi nite, Kaku Tatakaeri","Gate: Jieitai Kanochi nite, Kaku Tatakaeri",https://www.imdb.com/title/tt4958580/,Série de TV,7.5,24,2015,"Animação, Ação, Aventura, Comédia, Fantasia, Guerra",4464,2015-07-04,
246,tt6185782,2018-07-04,2018-07-04,,"A Empregada Dragão da Senhorita Kobayashi","Kobayashi-san Chi No Maid Dragon",https://www.imdb.com/title/tt6185782/,Série de TV,7.7,24,2017,"Animação, Comédia, Fantasia",5675,2018-01-25,
247,tt0477543,2017-10-09,2017-10-09,,"Tsubasa kuronikuru","Tsubasa kuronikuru",https://www.imdb.com/title/tt0477543/,Série de TV,7.2,25,2005,"Animação, Ação, Aventura, Drama, Família, Fantasia, Romance",1405,2005-04-09,
248,tt5341430,2018-04-23,2018-04-23,,"Hai to gensô no Grimgar","Hai to gensô no Grimgar",https://www.imdb.com/title/tt5341430/,Série de TV,7.3,24,2016,"Animação, Aventura, Drama, Fantasia",3475,2016-01-10,
249,tt0962740,2017-10-09,2017-10-09,,"Hell Girl","Jigoku shôjo",https://www.imdb.com/title/tt0962740/,Série de TV,7.4,,2005,"Animação, Drama, Fantasia, Terror, Mistério",2063,2005-10-04,
250,tt1356878,2018-05-27,2018-05-27,,"Hetalia: Axis Powers","Hetalia: Axis Powers",https://www.imdb.com/title/tt1356878/,Série de TV,7.2,5,2009,"Animação, Comédia",1470,2009-01-24,
251,tt3105452,2018-01-24,2018-01-24,,"Gôruden taimu","Gôruden taimu",https://www.imdb.com/title/tt3105452/,Série de TV,7.5,24,2013,"Animação, Comédia, Drama, Romance",5218,2013-10-03,
252,tt1339238,2017-07-03,2017-07-03,,"Sekirei","Sekirei",https://www.imdb.com/title/tt1339238/,Série de TV,7.2,23,2008,"Animação, Ação, Comédia, Fantasia, Romance",2930,2008-07-02,
253,tt0070968,2017-08-27,2017-08-27,,"Heidi, A Menina dos Alpes","Arupusu no shôjo Haiji",https://www.imdb.com/title/tt0070968/,Série de TV,7.5,24,1974,"Animação, Aventura, Comédia, Drama, Família",6248,1977,
254,tt2250034,2018-09-07,2018-09-07,,"Kokoro Connect","Kokoro Connect",https://www.imdb.com/title/tt2250034/,Minissérie de televisão,7.4,,2012,"Animação, Comédia, Drama, Mistério, Romance",2798,2012-07-07,
255,tt1209393,2017-08-27,2017-08-27,,"Vanpaia naito","Vanpaia naito",https://www.imdb.com/title/tt1209393/,Série de TV,7.2,24,2008,"Animação, Ação, Drama, Família, Fantasia, Terror, Mistério, Romance",5936,2008-04-07,
256,tt1685407,2017-12-01,2017-12-01,,"Kuroshitsuji II","Kuroshitsuji II",https://www.imdb.com/title/tt1685407/,Série de TV,7.3,,2010,"Animação, Ação, Comédia, Drama, Fantasia, Mistério",2680,2010-07-01,
257,tt4574736,2017-06-30,2017-06-30,,"Charlotte","Charlotte",https://www.imdb.com/title/tt4574736/,Minissérie de televisão,7.5,24,2015,"Animação, Comédia, Drama, Fantasia",9099,2015-07-04,
258,tt4584326,2017-06-30,2017-06-30,,"Owari No Seraph","Owari No Seraph",https://www.imdb.com/title/tt4584326/,Série de TV,7.4,24,2015,"Animação, Ação, Aventura, Família, Fantasia, Ficção científica",7542,2015-04-04,
259,tt2575678,2019-01-25,2019-01-25,,"Nekomonogatari (Kuro)","Nekomonogatari (Kuro)",https://www.imdb.com/title/tt2575678/,Minissérie de televisão,7.4,24,2012,"Animação, Comédia, Drama, Fantasia, Romance, Suspense",2734,2012-12-21,
260,tt0774809,2017-08-18,2017-08-18,,"Fate/stay night","Fate/stay night",https://www.imdb.com/title/tt0774809/,Série de TV,7.2,23,2006,"Animação, Ação, Aventura, Drama, Fantasia, Romance",6780,2006-01-06,
261,tt0476042,2017-09-16,2017-09-16,,"Gunslinger Girl","Gunslinger Girl",https://www.imdb.com/title/tt0476042/,Série de TV,7.3,24,2003,"Animação, Ação, Drama, Ficção científica",2359,2003-10-08,
262,tt2309312,2017-07-20,2017-07-20,,"Suki-tte î na yo.","Suki-tte î na yo.",https://www.imdb.com/title/tt2309312/,Série de TV,7.2,25,2012,"Animação, Drama, Romance",4412,2012-10-06,
263,tt6342474,2017-07-23,2017-07-23,,"Boruto: Naruto Next Generations","Boruto: Naruto Next Generations",https://www.imdb.com/title/tt6342474/,Série de TV,6.4,23,2017,"Animação, Ação, Aventura, Comédia, Drama, Fantasia",30887,2017-04-05,
264,tt1528567,2017-07-03,2017-07-03,,"Sora no Otoshimono","Sora no otoshimono",https://www.imdb.com/title/tt1528567/,Série de TV,7.2,,2009,"Animação, Ação, Comédia, Fantasia, Romance, Ficção científica",2232,2009-10-04,
265,tt5100366,2018-09-16,2018-09-16,,"O Cavalheirismo de um Cavaleiro Morto","Rakudai Kishi no Cavalry",https://www.imdb.com/title/tt5100366/,Série de TV,7.2,24,2015,"Animação, Ação, Fantasia, Romance",5023,2015-10-03,
266,tt2904418,2017-12-14,2017-12-14,,"Free!","Free!",https://www.imdb.com/title/tt2904418/,Série de TV,7.3,24,2013,"Animação, Comédia, Drama, Esportes",3819,2013-07-04,
267,tt4728568,2017-06-30,2017-06-30,,"DanMachi: É Errado Tentar Pegar Garotas em uma Masmorra?","Dungeon ni Deai wo Motomeru no wa Machigatteiru Darou ka",https://www.imdb.com/title/tt4728568/,Série de TV,7.4,24,2015,"Animação, Ação, Aventura, Comédia, Fantasia, Romance",11685,2015-04-04,
268,tt1086236,2017-06-30,2017-06-30,,"Lucky Star","Lucky Star",https://www.imdb.com/title/tt1086236/,Série de TV,7.4,25,2007,"Animação, Comédia",2609,2007-04-08,
269,tt2963556,2018-03-04,2018-03-04,,"Watashi ga motenai no wa dô kangaetemo omaera ga warui!","Watashi ga motenai no wa dô kangaetemo omaera ga warui!",https://www.imdb.com/title/tt2963556/,Série de TV,7.2,25,2013,"Animação, Comédia, Drama",2626,2013-07-08,
270,tt2321542,2017-06-30,2017-06-30,,"Chuunibyou demo koi ga shitai!","Chuunibyou demo koi ga shitai!",https://www.imdb.com/title/tt2321542/,Série de TV,7.4,25,2012,"Animação, Comédia, Drama, Fantasia, Romance",5333,2012-10-04,
271,tt2309302,2017-07-20,2017-07-20,,"Tonari no kaibutsu-kun","Tonari no kaibutsu-kun",https://www.imdb.com/title/tt2309302/,Minissérie de televisão,7.2,24,2012,"Animação, Comédia, Romance",5454,2012-10-02,
272,tt3115338,2017-07-20,2017-07-20,,"Nisekoi","Nisekoi",https://www.imdb.com/title/tt3115338/,Série de TV,7.2,25,2014,"Animação, Comédia, Romance",4380,2014-01-11,
273,tt3114376,2018-04-15,2018-04-15,,"Kyoukai no kanata","Kyoukai no kanata",https://www.imdb.com/title/tt3114376/,Série de TV,7.2,24,2013,"Animação, Ação, Comédia, Drama, Fantasia, Suspense",3155,2013-10-03,
274,tt0940874,2017-09-16,2017-09-16,,"Air","Air",https://www.imdb.com/title/tt0940874/,Série de TV,7.0,24,2005,"Animação, Drama, Fantasia, Romance",1542,2005-01-06,
275,tt0326672,2017-10-09,2017-10-09,,"Chobits","Chobits",https://www.imdb.com/title/tt0326672/,Série de TV,7.3,,2002,"Animação, Comédia, Drama, Romance, Ficção científica",4864,2002-04-02,
276,tt5025394,2017-09-17,2017-09-17,,"Gangsta","Gyangusuta",https://www.imdb.com/title/tt5025394/,Série de TV,7.2,24,2015,"Animação, Ação, Drama",3695,2015-07-01,
277,tt0364863,2018-06-16,2018-06-16,,"RahXephon","RahXephon",https://www.imdb.com/title/tt0364863/,Série de TV,7.2,25,2002,"Animação, Ação, Drama, Romance, Ficção científica",1812,2002-01-21,
278,tt0168366,2018-05-05,2018-05-05,,"Pokémon","Poketto monsutâ",https://www.imdb.com/title/tt0168366/,Série de TV,7.6,24,1997,"Animação, Ação, Aventura, Comédia, Família, Fantasia, Ficção científica",50187,1999-05-10,
279,tt0210418,2017-06-30,2017-06-30,,"Digimon","Digimon: Digital Monsters",https://www.imdb.com/title/tt0210418/,Série de TV,7.4,24,1999,"Animação, Ação, Aventura, Família, Fantasia, Ficção científica, Suspense",23876,2000-06-19,
280,tt4379632,2018-12-07,2018-12-07,,"Kekkai Sensen","Kekkai Sensen",https://www.imdb.com/title/tt4379632/,Série de TV,7.2,24,2015,"Animação, Ação, Aventura, Comédia, Fantasia",2798,2015-04-05,
281,tt2645500,2018-02-05,2018-02-05,,"Haganai","Boku wa tomodachi ga sukunai",https://www.imdb.com/title/tt2645500/,Série de TV,6.9,25,2011,"Animação, Comédia, Drama, Romance",2901,2011-09-22,
282,tt0434685,2017-08-22,2017-08-22,,"Gantz","Gantz",https://www.imdb.com/title/tt0434685/,Série de TV,7.1,22,2004,"Animação, Ação, Drama, Fantasia, Terror, Ficção científica",9023,2004-04-12,
283,tt2339875,2017-07-03,2017-07-03,,"Accel World","Accel World",https://www.imdb.com/title/tt2339875/,Série de TV,7.0,24,2012,"Animação, Ação, Romance, Ficção científica",2469,2012-04-06,
284,tt1685401,2017-07-03,2017-07-03,,"Highschool: Colégio da Morte","Gakuen mokushiroku: HIGHSCHOOL OF THE DEAD",https://www.imdb.com/title/tt1685401/,Série de TV,7.1,24,2010,"Animação, Ação, Drama, Terror, Romance, Suspense",16523,2010-07-05,
285,tt3544556,2017-07-03,2017-07-03,,"Aldnoah.Zero","Aldnoah.Zero",https://www.imdb.com/title/tt3544556/,Série de TV,7.1,25,2014,"Animação, Ação, Aventura, Drama, Romance, Ficção científica, Suspense, Guerra",2542,2014-07-05,
286,tt1780262,2018-04-11,2018-04-11,,"Kore wa Zombie desu ka?","Kore wa Zombie desu ka?",https://www.imdb.com/title/tt1780262/,Série de TV,6.9,25,2011,"Animação, Ação, Comédia, Fantasia, Romance",2045,2011-01-11,
287,tt2329220,2017-07-03,2017-07-03,,"Btooom!","Btooom!",https://www.imdb.com/title/tt2329220/,Série de TV,7.1,25,2012,"Animação, Ação, Drama, Terror, Ficção científica, Suspense",5044,2012-10-04,
288,tt0434670,2017-10-09,2017-10-09,,"Chrono Crusade","Chrono Crusade",https://www.imdb.com/title/tt0434670/,Série de TV,7.1,,2003,"Animação, Ação, Aventura, Comédia, Drama, Fantasia, Terror, Suspense",1701,2003-11-24,
289,tt1196027,2017-08-22,2017-08-22,,"Munemoshune no musume tachi","Munemoshune no musume tachi",https://www.imdb.com/title/tt1196027/,Minissérie de televisão,7.0,45,2008,"Animação, Ação, Drama, Fantasia, Terror, Mistério, Ficção científica, Suspense",2383,2008-02-03,
290,tt2122656,2017-07-03,2017-07-03,,"Guilty Crown","Guilty Crown",https://www.imdb.com/title/tt2122656/,Série de TV,7.0,23,2011,"Animação, Ação, Policial, Drama, Romance, Ficção científica, Suspense",5958,2011-10-13,
291,tt2760784,2018-05-27,2018-05-27,,"Blood Lad","Blood Lad",https://www.imdb.com/title/tt2760784/,Minissérie de televisão,7.0,24,2013,"Animação, Ação, Comédia, Drama, Fantasia, Terror",2513,2013-07-07,
292,tt5556656,2017-07-06,2017-07-06,,"Kotetsujo no Kabaneri","Kôtetsujô no Kabaneri",https://www.imdb.com/title/tt5556656/,Série de TV,7.2,23,2016,"Animação, Ação, Aventura, Drama, Fantasia, Terror",7019,2016-04-07,
293,tt0338621,2018-01-12,2018-01-12,,"Kirby","Hoshi no Kirby",https://www.imdb.com/title/tt0338621/,Série de TV,7.0,24,2001,"Animação, Ação, Aventura, Comédia, Família, Fantasia, Ficção científica",2441,2003-07-28,
294,tt7944664,2018-04-10,2018-04-10,,"B: The Beginning","B: The Beginning",https://www.imdb.com/title/tt7944664/,Série de TV,7.1,25,2018,"Animação, Ação, Policial, Drama, Suspense",5793,2018-03-02,
295,tt3874528,2017-09-21,2017-09-21,,"Mahouka koukou no rettousei","Mahouka koukou no rettousei",https://www.imdb.com/title/tt3874528/,Série de TV,7.0,22,2014,"Animação, Ação, Drama, Fantasia, Romance, Ficção científica",4423,2014-04-05,
296,tt7865090,2018-07-22,2018-07-22,,"Darling in the Franxx","DARLING in the FRANXX",https://www.imdb.com/title/tt7865090/,Série de TV,7.3,24,2018,"Animação, Ação, Drama, Romance, Ficção científica",15685,2018-01-13,
297,tt1909447,2017-06-30,2017-06-30,,"Deadman Wonderland","Deadman Wonderland",https://www.imdb.com/title/tt1909447/,Série de TV,7.1,24,2011,"Animação, Ação, Drama, Terror, Suspense",12605,2011-04-16,
298,tt8213522,2018-07-14,2018-07-14,,"Tokyo Ghoul: re","Tokyo Ghoul: re",https://www.imdb.com/title/tt8213522/,Série de TV,6.6,24,2018,"Animação, Ação, Drama, Fantasia, Terror, Mistério, Suspense",12723,2018-04-03,
299,tt0434694,2018-02-08,2018-02-08,,"Kidô senshi Gundam Seed Destiny","Kidô senshi Gundam Seed Destiny",https://www.imdb.com/title/tt0434694/,Série de TV,7.0,25,2004,"Animação, Ação, Aventura, Drama, Ficção científica, Guerra",1676,2004-10-09,
300,tt3257166,2017-07-03,2017-07-03,,"Black Bullet","Black Bullet",https://www.imdb.com/title/tt3257166/,Série de TV,6.8,25,2014,"Animação, Ação, Mistério, Ficção científica",3401,2014-04-08,
301,tt0791163,2017-10-09,2017-10-09,,"Trinity Blood","Trinity Blood",https://www.imdb.com/title/tt0791163/,Série de TV,7.1,,2005,"Animação, Ação, Drama, Terror, Ficção científica",2959,2005-04-28,
302,tt0978553,2017-07-03,2017-07-03,,"Zero no tsukaima","Zero no tsukaima",https://www.imdb.com/title/tt0978553/,Série de TV,6.9,24,2006,"Animação, Ação, Aventura, Comédia, Família, Fantasia, Romance",2574,2006-07-02,
303,tt3950092,2018-12-25,2018-12-25,,"Ookami shoujo to kuro ouji","Ookami shoujo to kuro ouji",https://www.imdb.com/title/tt3950092/,Minissérie de televisão,6.9,24,2014,"Animação, Comédia, Romance",3179,2014-10-04,
304,tt1161684,2017-07-03,2017-07-03,,"Rosario + Vampire","Rozario to banpaia",https://www.imdb.com/title/tt1161684/,Série de TV,6.8,25,2008,"Animação, Comédia, Fantasia, Romance",3907,2008-01-03,
305,tt1048049,2017-08-18,2017-08-18,,"Devil May Cry","Devil May Cry: Debiru mei kurai",https://www.imdb.com/title/tt1048049/,Minissérie de televisão,7.0,24,2007,"Animação, Ação, Fantasia, Terror",5889,2007-06-14,
306,tt0279570,2017-09-18,2017-09-18,,"Rabu Hina","Rabu Hina",https://www.imdb.com/title/tt0279570/,Série de TV,6.9,544,2000,"Animação, Comédia, Drama, Romance",2433,2006-04-11,
307,tt0249327,2017-06-30,2017-06-30,,"Yu-Gi-Oh!","Yu-Gi-Oh!",https://www.imdb.com/title/tt0249327/,Série de TV,7.3,24,2000,"Animação, Ação, Aventura, Família, Fantasia",24361,2002-04-22,
308,tt0264530,2018-03-02,2018-03-02,,"Devilman","Debiruman",https://www.imdb.com/title/tt0264530/,Minissérie de televisão,7.1,57,1987,"Animação, Ação, Fantasia, Terror",1999,1987-11-01,
309,tt7131720,2018-07-02,2018-07-02,,"Kakegurui","Kakegurui",https://www.imdb.com/title/tt7131720/,Série de TV,7.1,24,2017,"Animação, Drama, Mistério, Suspense",14402,2017-07-01,
310,tt2575684,2017-07-03,2017-07-03,,"Date a Live","Date a Live",https://www.imdb.com/title/tt2575684/,Série de TV,6.9,25,2013,"Animação, Ação, Comédia, Fantasia, Romance, Ficção científica, Suspense",4498,2013-04-05,
311,tt3592708,2017-07-20,2017-07-20,,"Blue Spring Ride","Ao Haru Ride",https://www.imdb.com/title/tt3592708/,Série de TV,7.5,122,2014,"Animação, Comédia, Drama, Romance",6820,2014-07-07,
312,tt0361140,2017-10-09,2017-10-09,,".hack//SIGN",".hack//SIGN",https://www.imdb.com/title/tt0361140/,Série de TV,6.8,25,2002,"Animação, Ação, Aventura, Drama, Fantasia, Mistério, Ficção científica, Suspense",1479,2002-04-03,
313,tt1909463,2018-05-27,2018-05-27,,"Freezing","Freezing",https://www.imdb.com/title/tt1909463/,Série de TV,6.7,24,2011,"Animação, Ação, Drama, Romance, Ficção científica",1895,2011-01-08,
314,tt1308089,2018-10-05,2018-10-05,,"To aru majutsu no indekkusu","To aru majutsu no indekkusu",https://www.imdb.com/title/tt1308089/,Série de TV,6.8,23,2008,"Animação, Ação, Comédia, Drama, Família, Fantasia, Romance, Ficção científica",2416,2008-10-04,
315,tt5847454,2017-09-17,2017-09-17,,"Berserk","Beruseruku",https://www.imdb.com/title/tt5847454/,Série de TV,6.7,24,2016,"Animação, Ação, Aventura, Drama, Fantasia, Terror",8144,2016-07-01,
316,tt0139774,2017-06-30,2017-06-30,,"Dragon Ball GT","Dragon Ball GT: Doragon bôru jîtî",https://www.imdb.com/title/tt0139774/,Série de TV,6.8,24,1996,"Animação, Ação, Aventura, Comédia, Fantasia, Ficção científica, Suspense",30166,2002-12-02,
317,tt1929675,2018-04-11,2018-04-11,,"Infinite Stratos","Infinite Stratos",https://www.imdb.com/title/tt1929675/,Série de TV,6.5,24,2011,"Animação, Ação, Comédia, Romance, Ficção científica",2271,2011-01-07,
318,tt0328733,2017-06-30,2017-06-30,,"Beyblade","Bakuten shoot beyblade",https://www.imdb.com/title/tt0328733/,Série de TV,6.8,30,2001,"Animação, Ação, Família, Fantasia, Ficção científica, Esportes, Suspense",7266,2002-10-07,
319,tt0293731,2017-06-30,2017-06-30,,"Medabots","Medabots",https://www.imdb.com/title/tt0293731/,Série de TV,6.8,30,1999,"Animação, Ação, Aventura, Comédia, Família, Ficção científica",2573,2001-11-18,
320,tt0316975,2017-07-23,2017-07-23,,"Digimon 4","Dejimon furontiâ",https://www.imdb.com/title/tt0316975/,Série de TV,6.7,,2002,"Animação, Ação, Aventura, Família, Fantasia, Ficção científica, Suspense",3011,2002-04-07,
321,tt0493334,2017-06-30,2017-06-30,,"Yu-Gi-Oh! GX","Yu-Gi-Oh! GX",https://www.imdb.com/title/tt0493334/,Série de TV,6.8,30,2004,"Animação, Ação, Aventura, Comédia, Família, Fantasia, Ficção científica",5532,2006-03-11,
322,tt6424454,2019-01-10,2019-01-10,,"Fate/Apocrypha","Fate/Apocrypha",https://www.imdb.com/title/tt6424454/,Série de TV,6.6,24,2017,"Animação, Ação, Drama, Fantasia",2865,2017-07-02,
323,tt0318895,2017-06-30,2017-06-30,,"Hamtaro","Tottoko Hamutaro",https://www.imdb.com/title/tt0318895/,Série de TV,6.4,30,2000,"Animação, Aventura, Comédia, Família, Fantasia",2718,2002-04-01,
324,tt1068993,2017-07-06,2017-07-06,,"Sukûru deizu","Sukûru deizu",https://www.imdb.com/title/tt1068993/,Minissérie de televisão,5.9,,2007,"Animação, Drama, Terror, Romance, Suspense",3161,2007-07-03,
325,tt0367413,2017-06-30,2017-06-30,,"Sonic X","Sonic X",https://www.imdb.com/title/tt0367413/,Série de TV,6.3,30,2003,"Animação, Ação, Aventura, Comédia, Família, Fantasia, Ficção científica",6076,2003-04-06,
326,tt1114855,2017-06-30,2017-06-30,,"Bakugan: Guerreiros da Batalha","Bakugan Battle Brawlers",https://www.imdb.com/title/tt1114855/,Série de TV,5.8,22,2007,"Animação, Ação, Aventura, Comédia, Família, Fantasia, Ficção científica",3727,2009-03-02,
327,tt8690728,2019-01-28,2019-01-28,,"Matador de Goblins","Goblin Slayer",https://www.imdb.com/title/tt8690728/,Série de TV,7.4,30,2018,"Animação, Ação, Aventura, Fantasia, Terror",11400,2018-10-07,
328,tt4958610,2019-01-31,2019-01-31,,"Rokka ~Bravos das Seis Flores~","Rokka no Yuusha",https://www.imdb.com/title/tt4958610/,Minissérie de televisão,6.8,24,2015,"Animação, Ação, Aventura, Fantasia, Mistério, Suspense",2338,2015-07-04,
329,tt5839732,2019-02-03,2019-02-03,,"Orange","Orange",https://www.imdb.com/title/tt5839732/,Minissérie de televisão,7.6,24,2016,"Animação, Drama, Romance, Ficção científica",5080,2016-07-02,
330,tt5595178,2019-02-21,2019-02-21,,"Brotherhood: Final Fantasy XV","Brotherhood: Final Fantasy XV",https://www.imdb.com/title/tt5595178/,Série de TV,7.0,15,2016,"Animação, Ação, Aventura, Drama, Fantasia, Ficção científica",1675,2016-03-30,
331,tt4755410,2019-02-25,2019-02-25,,"Durarara!!x2","Durarara!!x2",https://www.imdb.com/title/tt4755410/,Série de TV,7.7,24,2015,"Animação, Comédia, Policial, Drama, Suspense",2212,2015-01-10,
332,tt5240222,2019-02-26,2019-02-26,,"God Eater","God Eater",https://www.imdb.com/title/tt5240222/,Série de TV,6.9,24,2015,"Animação, Ação, Ficção científica",2388,2015-07-12,
333,tt0440988,2019-03-04,2019-03-04,,"Desert Punk","Sunabôzu",https://www.imdb.com/title/tt0440988/,Série de TV,7.2,580,2004,"Animação, Ação, Comédia, Ficção científica",1512,2004-10-04,
334,tt1634209,2019-03-04,2019-03-04,,"Beijo x Mana","Kiss x sis",https://www.imdb.com/title/tt1634209/,Série de TV,6.0,24,2010,"Animação, Comédia, Drama, Romance",2597,2010-08-05,
335,tt1636694,2019-03-04,2019-03-04,,"Demon King Daimao","Ichiban ushiro no daimaou",https://www.imdb.com/title/tt1636694/,Série de TV,6.6,24,2010,"Animação, Ação, Comédia, Fantasia",2901,2010-04-03,
336,tt6357658,2019-04-12,2019-04-12,,"Baki","Baki",https://www.imdb.com/title/tt6357658/,Série de TV,6.8,45,2016,"Animação, Ação, Drama, Esportes",9793,2018-12-18,
337,tt9054364,2019-04-15,2019-04-15,,"That Time I Got Reincarnated as a Slime","Tensei Shitara Suraimu Datta Ken",https://www.imdb.com/title/tt9054364/,Série de TV,8.1,25,2018,"Animação, Ação, Aventura, Comédia, Fantasia",18159,2018-10-02,
338,tt1751305,2019-05-28,2019-05-28,,"Ore no imouto ga konna ni kawaii wake ga nai","Ore no imouto ga konna ni kawaii wake ga nai",https://www.imdb.com/title/tt1751305/,Série de TV,6.4,25,2010,"Animação, Comédia, Drama, Romance",1842,2010-10-03,
339,tt8699270,2019-06-19,2019-06-19,,"Ultraman","Ultraman",https://www.imdb.com/title/tt8699270/,Série de TV,6.8,25,2019,"Animação, Ação, Aventura, Drama, Fantasia, Ficção científica",2744,2019-04-01,
340,tt5987956,2019-06-21,2019-06-21,,"Ao no Exorcist: Kyoto Fujouou-hen","Ao no ekusoshisuto: Kyoto fujô ô-hen",https://www.imdb.com/title/tt5987956/,Série de TV,7.3,24,2017,"Animação, Ação, Drama, Fantasia, Terror",2995,2017-01-07,
341,tt0105559,2019-08-01,2019-08-01,,"Tenchi Muyô!","Tenchi Muyô!",https://www.imdb.com/title/tt0105559/,Série de TV,7.6,30,1992,"Animação, Aventura, Comédia, Fantasia, Romance, Ficção científica",2304,1992-09-25,
342,tt1329466,2019-08-01,2019-08-01,,"Sukippu bîto!","Sukippu bîto!",https://www.imdb.com/title/tt1329466/,Série de TV,7.8,24,2008,"Animação, Comédia, Drama, Romance",1740,2008-10-05,
343,tt2196757,2019-08-03,2019-08-03,,"Inuboku Secret Service","Inu x Boku SS",https://www.imdb.com/title/tt2196757/,Série de TV,7.0,24,2012,"Animação, Comédia, Romance",1868,2012-01-12,
344,tt8433216,2019-08-08,2019-08-08,,"Super Dragon Ball Heroes","Super Dragon Ball Heroes",https://www.imdb.com/title/tt8433216/,Série de TV,6.7,10,2018,"Animação, Ação, Aventura, Fantasia",3618,2018-07-01,
345,tt6908976,2019-08-14,2019-08-14,,"Saint Seiya: Os Cavaleiros do Zodíaco","Seinto Seiya: Knights of the Zodiac",https://www.imdb.com/title/tt6908976/,Série de TV,4.7,24,2019,"Animação, Ação, Aventura, Fantasia, Ficção científica",2302,2019-07-19,
346,tt4831392,2019-08-16,2019-08-16,,"MONSTER MUSUME: A Vida com Mulheres-Monstro","Monster Musume no Iru Nichijou",https://www.imdb.com/title/tt4831392/,Série de TV,6.6,23,2015,"Animação, Comédia, Fantasia, Romance",3651,2015-06-27,
347,tt5023666,2019-08-31,2019-08-31,,"Arslan Senki","Arslan Senki",https://www.imdb.com/title/tt5023666/,Série de TV,7.5,24,2015,"Animação, Ação, Aventura, Fantasia",2466,2015-04-05,
348,tt4663062,2019-08-31,2019-08-31,,"Dragon Ball Z: The Tree of Might","Dragon Ball Z: The Tree of Might",https://www.imdb.com/title/tt4663062/,Minissérie de televisão,7.4,,1997,"Animação, Ação, Aventura, Ficção científica",1629,1997-11-15,
349,tt0061300,2019-08-31,2019-08-31,,"Speed Racer","Mahha GoGoGo",https://www.imdb.com/title/tt0061300/,Série de TV,7.2,30,1967,"Animação, Ação, Aventura, Comédia, Família, Ficção científica, Esportes",3562,1967-04-02,
350,tt0100044,2019-08-31,2019-08-31,,"The Record of the Lodoss War","Rôdosu-tô senki",https://www.imdb.com/title/tt0100044/,Série de TV,7.5,25,1990,"Animação, Ação, Aventura, Fantasia, Romance",3038,1990-06-30,
351,tt0144069,2019-08-31,2019-08-31,,"Street Fighter II: Victory","Street Fighter II: V",https://www.imdb.com/title/tt0144069/,Série de TV,7.5,22,1995,"Animação, Ação, Aventura, Drama, Fantasia",2559,1995-04-10,
352,tt0294154,2019-08-31,2019-08-31,,"Noir","Noir",https://www.imdb.com/title/tt0294154/,Série de TV,7.2,,2001,"Animação, Ação, Policial, Drama, Mistério, Suspense",2095,2001-04-06,
353,tt0402716,2019-08-31,2019-08-31,,"Witch Hunter Robin","Witch Hunter Robin",https://www.imdb.com/title/tt0402716/,Série de TV,7.1,25,2002,"Animação, Ação, Aventura, Drama, Fantasia, Mistério",2268,2002-07-03,
354,tt0280240,2019-08-31,2019-08-31,,"The Big O","The Big O",https://www.imdb.com/title/tt0280240/,Série de TV,7.5,,1999,"Animação, Ação, Aventura, Mistério, Ficção científica",2455,1999-10-13,
355,tt0158591,2019-08-31,2019-08-31,,"Dominion","Dominion",https://www.imdb.com/title/tt0158591/,Minissérie de televisão,6.8,35,1988,"Animação, Ação, Comédia, Policial, Ficção científica, Suspense",1849,1988-05-27,
356,tt0400690,2019-08-31,2019-08-31,,"Juubee Ninpuuchou: Ryuuhougyoku-hen","Jûbê ninpûchô: Ryûhôgyoku-hen",https://www.imdb.com/title/tt0400690/,Série de TV,6.8,30,2003,"Animação, Ação, Aventura, Comédia, Fantasia, Terror",1942,2003-04-14,
